[
  {
    "shot_id": 1,
    "start_sec": 0.0,
    "end_sec": 1.5,
    "duration": 1.5,
    "subject": "少女,白色衣裙",
    "action": "从画面左侧走入,举手打招呼",
    "camera": "中景平视,固定机位",
    "scene": "明亮城市街道,远景有树",
    "lighting": "自然日光,顺光,亮调",
    "style": "3D 动画,写实渲染,柔和色彩",
    "prompt_text": "3D 动画,写实渲染,明亮城市街道,白色衣裙少女中景平视走入画面,自然日光,柔和色彩"
  },
  {
    "shot_id": 2,
    "start_sec": 1.5,
    "end_sec": 3.0,
    "duration": 1.5,
    "subject": "街道特写,落叶飘过",
    "action": "镜头缓缓推近,一片落叶飘过前景",
    "camera": "近景缓推",
    "scene": "城市街道,路面湿润",
    "lighting": "侧逆光,金色暖调",
    "style": "3D 动画,写实渲染,浅景深",
    "prompt_text": "3D 动画,写实渲染,湿润城市街道近景缓推,落叶飘过,金色侧逆光,浅景深"
  }
]
